<?xml version="1.0" encoding="UTF-8"?>
<!--
   The contents of this file are subject to the terms of the Common Development and
   Distribution License (the License). You may not use this file except in compliance with the
   License.

   You can obtain a copy of the License at legal/CDDLv1.0.txt. See the License for the
   specific language governing permission and limitations under the License.

   When distributing Covered Software, include this CDDL Header Notice in each file and include
   the License file at legal/CDDLv1.0.txt. If applicable, add the following below the CDDL
   Header, with the fields enclosed by brackets [] replaced by your own identifying
   information: "Portions copyright [year] [name of copyright owner]".

   Copyright 2014 ForgeRock AS.
-->

<!DOCTYPE Policies PUBLIC "-//iPlanet//OpenSSO 2005Q4 Admin CLI DTD//EN" "jar://com/sun/identity/policy/policyAdmin.dtd">

<Policies>
    <Policy name="AgentAccessToValidationService" referralPolicy="false" active="true" >
        <Rule name="agent-read-access-to-validation-service">
            <ServiceName name="sunAMDelegationService" />
            <ResourceName name="sms://*@SM_CONFIG_ROOT_SUFFIX@/validationService/1.0/OrganizationConfig/*" />
            <AttributeValuePair>
                <Attribute name="READ" />
                <Value>allow</Value>
            </AttributeValuePair>
        </Rule>
        <Subjects name="Subjects" description="">
            <Subject name="AuthenticatedAgents" type="AuthenticatedAgents" includeType="inclusive">
            </Subject>
        </Subjects>
    </Policy>
</Policies>
